id,job_id,chunk_index,chunk_text,status,audio_url,error,created_at,updated_at
de5db688-baa3-4e03-8341-4e6e3341aa21,c64ab137-f340-4b1e-9e5e-fc77137aeaf8,5,"Alice: That's a great point, Bob. The article mentions that India has reservations regarding alternative service methods. This can pose challenges when attempting to serve documents through diplomatic or consular channels. Additionally, the central authority of a receiving country may have the power to reject a service request under certain circumstances.

Bob: Right, and sometimes, parties involved in litigation may resort to alternative methods like email service, as highlighted in the case of Duong v. DDG BIM Services LLC. It's interesting to see how courts handle situations where the central authority fails to act under the Hague Convention.

Alice: Absolutely, Bob. In that case, the U.S. court emphasized that Article 15 of the Convention allows for a default judgment to be entered if the central authority fails to fulfill its obligations. It acts as a ""safety valve"" when the traditional methods of service face challenges.

Bob: Fascinating! So, what does the future hold for the Hague Service Convention?

Alice: Well, Bob, as cross-border litigation continues to increase, we can expect the Convention to remain a vital tool for serving summons across borders. However, it's possible that there may be ongoing debates and discussions about its application and potential improvements.

Bob: That's true, Alice. We might see advancements in technology playing a role in the service of judicial documents, making the process more efficient and accessible.

Alice: Absolutely, Bob. Innovation and evolving practices will continue to shape the future of cross-border legal proceedings.

",completed,https://vrsbermuilpkvjdnnhtf.supabase.co/storage/v1/object/public/audio-files/chunks/17abd9a3-a3c7-4a17-9692-171809b4f857/c64ab137-f340-4b1e-9e5e-fc77137aeaf8/chunk_5.mp3,,2025-03-01 07:28:59.23778+00,2025-03-01 07:32:36.878145+00
e8afb863-7281-4a99-94e7-3a6d49508a12,c64ab137-f340-4b1e-9e5e-fc77137aeaf8,9,"Bob: And stay tuned for our next article, where we'll be diving into another fascinating topic. Don't miss it!

Alice: Let's discuss the article: ""U.S. Ukraine Policy Shift Impact on Russia-Ukraine War."" In recent news, there has been a significant shift in the U.S.'s policy towards Ukraine and Russia. The previous administration had refrained from engaging in peace talks with Russia since the start of the war in Ukraine in 2014. However, the current U.S. Secretary of State, Marco Rubio, recently met with Russian Foreign Minister Sergey Lavrov in Riyadh, marking a reversal in this policy.

Bob: That's right, Alice. This change in policy comes as a result of President Trump's election campaign promise to ""end the war in Ukraine."" Since taking office, President Trump has had phone conversations with both Russian President Vladimir Putin and Ukrainian President Volodymyr Zelenskyy. It's interesting to see how this new approach will impact the ongoing conflict.

Alice: Absolutely, Bob. The big question here is whether the U.S.'s changed Ukraine policy will actually lead to an end to the Russia-Ukraine war. Kanwal Sibal and Anuradha Chenoy, two experts on the matter, discuss this very question in the article. They touch upon the motivations behind President Trump's peace overtures to Russia and the domestic dynamics at play.

Bob: It seems that President Trump's position on Russia is still somewhat unpredictable. He has already begun a dialogue with Russia, which is a significant departure from the previous administration's stance. However, his harsh comments towards Ukrainian President Zelenskyy, calling him a dictator, and his focus on economic interests raise questions about the true intent behind his approach.

",completed,https://vrsbermuilpkvjdnnhtf.supabase.co/storage/v1/object/public/audio-files/chunks/17abd9a3-a3c7-4a17-9692-171809b4f857/c64ab137-f340-4b1e-9e5e-fc77137aeaf8/chunk_9.mp3,,2025-03-01 07:29:00.350838+00,2025-03-01 07:34:49.147027+00
e8c7f264-85a4-4f31-99f0-7bf9c2eb9da6,c64ab137-f340-4b1e-9e5e-fc77137aeaf8,1,"Bob: And finally, Alice, we'll be shining a light on a flawed bill that's threatening free and fair elections. It's crucial we keep an eye on the state of our democratic processes, and we'll be exploring the potential consequences of this troubling legislation.

Alice: So, folks, as you can see, we've got a jam-packed episode in store for you. From the political landscape in Germany to the heroic rats of Africa, we'll be covering it all. So grab your favorite beverage, find a cozy spot, and let's dive right in!

Bob: That's right, Alice. Get ready for an engaging and thought-provoking journey through the world of current affairs. Stay tuned for the full episode, coming right up!

[Music fades in]

Alice: Let's discuss the article: Germany's Election Results: Understanding AfD's Impact. 

Bob: Ah, Germany's federal elections. It's always interesting to see how these elections shape the political landscape of a country. 

Alice: Absolutely. And this election had some major issues that influenced the outcome. One of the key takeaways was the rise of the far-right Alternative for Germany, or AfD.

Bob: Right. The conservative Christian Democratic Union (CDU) and the Christian Social Union (CSU) won the most votes, but it's the AfD's rise that has caught everyone's attention. It's a clear indication of the changing political landscape in Germany.

Alice: Definitely. And one of the major issues that played a role in these elections was immigration. The CDU, AfD, and other parties called for tougher immigration regulations, while the Social Democrats (SPD) and Greens took a more moderate stance.

",completed,https://vrsbermuilpkvjdnnhtf.supabase.co/storage/v1/object/public/audio-files/chunks/17abd9a3-a3c7-4a17-9692-171809b4f857/c64ab137-f340-4b1e-9e5e-fc77137aeaf8/chunk_1.mp3,,2025-03-01 07:28:58.123047+00,2025-03-01 07:30:15.666748+00
e9a339b4-7baa-49c6-9774-ca4092a76c3f,c64ab137-f340-4b1e-9e5e-fc77137aeaf8,13,"Bob: Absolutely, Alice. The new initiative announced by Prime Minister Modi and President Trump, called the Autonomous Systems Industry Alliance, further boosts cooperation in this area. And it's not just limited to that. The joint statement also mentions the possibility of greater cooperation in undersea systems and fifth-generation fighter aircraft, as well as accelerated cooperation in space, air defense, and anti-tank missiles. It's clear that both countries are looking to deepen their defense cooperation.

Alice: Definitely, Bob. However, as the article points out, there are still some challenges to overcome. One of the critical elements missing in the joint statement was the mention of the urgent delivery of General Electric's F-404 GE-IN-20 engines for the India-made Tejas-Mark 1A fighter aircraft. And the absence of any word on this is cause for concern, especially considering the dwindling number of Indian Air Force fighter squadrons.

Bob: That's right, Alice. It seems there are still some gaps that need to be addressed. And another challenge mentioned in the article is the potential integration of the F-35 Lightning II fighter aircraft into the Indian Air Force. This could be difficult to pull off due to the IAF's existing capability deficits and the cost and potential restrictions that may come with the F-35.

Alice: Absolutely, Bob. Integrating the F-35 would require substantial infrastructure and maintenance costs, and there might be restrictions on its use imposed by the U.S. government. It's clear that there are still some hurdles to overcome in terms of defense cooperation between the U.S. and India.

",pending,,,2025-03-01 07:29:00.954269+00,2025-03-01 07:29:00.954269+00
f66b732f-28f5-4ef4-a64d-2202e6964554,c64ab137-f340-4b1e-9e5e-fc77137aeaf8,3,"Bob: Absolutely. And it's not just Germany that's experiencing a right-wing shift. France, Italy, and Hungary have also seen similar trends. It's a broader shift in European politics.

Alice: Definitely. Well, that's all for this article. It's fascinating to see how elections can shape the political landscape and the future of a country like Germany.

Bob: Absolutely. Stay tuned for more interesting articles and discussions on our podcast. Thanks for listening!

[Smooth transition to the next topic]

Alice: Let's discuss the article: The Hague Service Convention: Serving Summons Across Borders. 

Bob: Ah, the Hague Service Convention, that sounds intriguing. What exactly is it, Alice?

Alice: Well, Bob, the Hague Service Convention is a multilateral treaty adopted in 1965. It provides a mechanism for serving judicial and extrajudicial documents on parties residing in foreign jurisdictions. It ensures that defendants sued in foreign countries receive timely notice of legal proceedings, while also facilitating proof of service.

Bob: That's fascinating! So, how does the U.S. Securities and Exchange Commission (SEC) use the Hague Service Convention to serve summons on individuals like Gautam Adani and Sagar Adani?

Alice: According to the article, the SEC has invoked Article 5(a) of the Convention to request India's Ministry of Law and Justice to facilitate the service of summons on the Adanis. Additionally, the SEC is exploring alternative service methods permitted under the Federal Rules of Civil Procedure.

Bob: Ah, I see. And it's interesting to note that India has certain reservations under the Convention, right?

",completed,https://vrsbermuilpkvjdnnhtf.supabase.co/storage/v1/object/public/audio-files/chunks/17abd9a3-a3c7-4a17-9692-171809b4f857/c64ab137-f340-4b1e-9e5e-fc77137aeaf8/chunk_3.mp3,,2025-03-01 07:28:58.674022+00,2025-03-01 07:31:26.859037+00