id,job_id,chunk_index,chunk_text,status,audio_url,error,created_at,updated_at
1a71f425-2c6e-49be-b7dd-d1a1e9df8c91,c64ab137-f340-4b1e-9e5e-fc77137aeaf8,14,"Bob: Indeed, Alice. But despite these challenges, there is a stable momentum in the defense cooperation between the two countries. The joint statement and agreements signed during Prime Minister Modi's visit are steps in the right direction. It will be interesting to see how both sides address the challenges and move forward.

Alice: That's all for this article. It's clear that U.S.-India defense ties are evolving, and there are both opportunities and challenges ahead. We'll keep an eye on this topic and see how it develops in the future.

Bob: Absolutely, Alice. It's an important relationship to watch, and it will have implications not just for the two countries but also for the broader region. Stay tuned for more updates on this exciting development.

Alice: Let's discuss the article ""Flawed Bill Threatening Free and Fair Elections."" In this article, P.D.T. Achary highlights the concerns regarding the Chief Election Commissioner and Other Election Commissioners (Appointment, Conditions of Service and Term of Office) Bill. 

Bob: That's right, Alice. This bill was enacted by Parliament in response to a Supreme Court order, which stated that the appointment of the Chief Election Commissioner and Election Commissioners should be based on a recommendation made by a high-power committee. The aim was to ensure the impartiality of the Election Commission of India in conducting elections.

Alice: Absolutely. The article points out that the new law replaced the Chief Justice of India with a cabinet Minister nominated by the Prime Minister in the committee. This change has been challenged in court as it violates the Supreme Court's direction. It raises concerns about the composition of the selection panel and the potential impact on the fairness and objectivity of the selection process.

",pending,,,2025-03-01 07:29:01.358778+00,2025-03-01 07:29:01.358778+00
25ac067d-fd82-487e-9a5a-a0844ea1fcaa,c64ab137-f340-4b1e-9e5e-fc77137aeaf8,8,"Bob: That's right, Alice. Researchers are going back to nature and learning from these animals to develop faster and more efficient diagnostic tools. And in the case of TB diagnosis, integrating rat-based detection into India's National TB Elimination Programme could significantly enhance case detection, particularly among children and smear-negative patients.

Alice: Absolutely, Bob. Tuberculosis specialists in India believe that the cost-effectiveness, speed, and accuracy of trained African giant pouched rats make them a viable screening tool in high TB-burden areas. A phased approach, starting in select high-burden areas and states, followed by controlled expansion, could ensure feasibility and effectiveness.

Bob: And it's exciting to hear that Dr. Agizew from APOPO hopes to introduce these trained rats to India as secondary diagnostic tools. This collaboration could greatly accelerate diagnosis, save lives, and support India's efforts to eradicate TB.

Alice: It's definitely an innovative approach that could make a significant difference, Bob. With India still facing high rates of undiagnosed TB, especially in underserved areas, the use of HeroRATS could be a solution worth exploring.

Bob: Absolutely, Alice. These HeroRATS have already shown remarkable results in Tanzania, Mozambique, and Ethiopia. It's time to revive the discussions and consider implementing this program in India.

Alice: That's all for this article. It's incredible to see how animals can contribute to our healthcare system. But what do you think, listeners? Would you trust a rat's diagnosis? Let us know your thoughts!

",completed,https://vrsbermuilpkvjdnnhtf.supabase.co/storage/v1/object/public/audio-files/chunks/17abd9a3-a3c7-4a17-9692-171809b4f857/c64ab137-f340-4b1e-9e5e-fc77137aeaf8/chunk_8.mp3,,2025-03-01 07:29:00.192456+00,2025-03-01 07:33:59.198456+00
2e450a59-c748-49bb-ac8a-439b7f67a6bc,c64ab137-f340-4b1e-9e5e-fc77137aeaf8,6,"Bob: Well, that's all for this article. The Hague Service Convention is a significant international agreement that ensures proper service of summons across borders. It's fascinating to see how it operates and the challenges it presents. 

Alice: That's right, Bob. Stay tuned for our next article, where we'll delve into another interesting topic. Don't forget to subscribe to our podcast to stay updated!

Bob: Thanks for listening, and until next time!

Alice: Let's discuss the article: ""Innovative TB diagnosis: African giant pouched rats to the rescue."" Tuberculosis is a disease that continues to pose significant challenges worldwide, causing millions of infections each year. In India alone, it is estimated that over 5 lakh people die from TB annually. Despite medical advancements, detecting TB remains a major challenge, especially in remote and underserved populations.

Bob: That's right, Alice. Traditional diagnostics often fail to detect TB in its early stages, particularly in children and people with low bacillary loads. This means that many cases may go undetected, leading to further transmission of the disease. Additionally, slow and insufficient diagnostic facilities, especially in rural areas, make it difficult for people to access timely testing.

Alice: Absolutely, Bob. But here's where things get interesting. A non-profit organization called APOPO, based in Tanzania, has come up with an innovative solution using African giant pouched rats to detect TB in sputum samples. These rats, also known as HeroRATS, have an outstanding ability to sniff diseases due to their sensitive olfactory receptors.

",completed,https://vrsbermuilpkvjdnnhtf.supabase.co/storage/v1/object/public/audio-files/chunks/17abd9a3-a3c7-4a17-9692-171809b4f857/c64ab137-f340-4b1e-9e5e-fc77137aeaf8/chunk_6.mp3,,2025-03-01 07:28:59.63994+00,2025-03-01 07:33:04.596476+00
52954d1a-cc32-4819-bee5-10723e043a64,c64ab137-f340-4b1e-9e5e-fc77137aeaf8,10,"Alice: That's true, Bob. President Trump has emphasized the need for Mr. Zelenskyy to legitimize himself through elections in Ukraine, which aligns with Russia's demand as well. He has also mentioned the U.S.'s financial investment in the war and the desire to recover those funds. However, the core issue at stake is the role of the U.S. in providing security to Europe.

Bob: It's interesting to note that President Trump has also highlighted the expansion of NATO as a reason for the Ukraine conflict. This is the first time a U.S. President has made such a statement. It certainly adds another layer to the complexities of the situation.

Alice: Absolutely, Bob. Now, let's talk about the potential impact of this policy shift on the war itself. Kanwal Sibal and Anuradha Chenoy believe that Russia is currently winning the war, and President Trump's actions may be a way of managing this defeat in the best way possible. They also mention how Ukraine's military operations have faced significant challenges, and European countries have a vested interest in the war continuing.

Bob: That's right, Alice. President Zelenskyy is facing a difficult choice. He can either agree to President Trump's plan or face a complete collapse on the battlefield. If the U.S. withdraws funding, Ukraine would likely collapse. So, it's a choice between the devil and the deep blue sea for President Zelenskyy.

Alice: It's a tough situation indeed, Bob. On one hand, he could seek some security guarantees for the remaining parts of Ukraine and hope for economic deals and reconstruction. On the other hand, Mr. Putin has made it clear that Russian troops will continue to advance until a ceasefire is reached. The stakes are high, and the consequences of the choices made will be significant.

",completed,https://vrsbermuilpkvjdnnhtf.supabase.co/storage/v1/object/public/audio-files/chunks/17abd9a3-a3c7-4a17-9692-171809b4f857/c64ab137-f340-4b1e-9e5e-fc77137aeaf8/chunk_10.mp3,,2025-03-01 07:29:00.514455+00,2025-03-01 07:35:19.710153+00
589ac8bf-d245-40f4-996e-de4a82704612,c64ab137-f340-4b1e-9e5e-fc77137aeaf8,2,"Bob: The migrant crisis certainly had a big impact on the rise of the AfD. The government's lenient approach to refugees created a divide among the population, and the AfD capitalized on that by showcasing a stricter stance on immigration and border control.

Alice: That's true. Another major issue was the economy. The parties focused on increasing economic competitiveness and debated issues like the debt brake law, which restricts the structural deficit. CDU and FDP supported it, while the SPD and Greens wanted to relax it.

Bob: And let's not forget about foreign policy. Most parties supported Ukraine and NATO, but the AfD and BSW had different views. They opposed military aid and favored closer ties with Russia. It's interesting to see how foreign policy can shape elections.

Alice: Absolutely. So, with the rise of the AfD, the big question is whether the CDU will be able to form a stable government. They need to negotiate with other parties to form a coalition majority.

Bob: That's right. The election system in Germany promotes coalition governments, and the CDU and CSU fell short of a majority. They need support from either the SPD or the AfD, but both options have their challenges.

Alice: Negotiating with the SPD on social policy could be difficult, and the mainstream parties have vowed not to work with the AfD. It's a tricky situation for the CDU.

Bob: It certainly is. But Germany's political system is well-structured to facilitate negotiations and prevent a political impasse. So, there's still hope for a stable government to be formed.

Alice: That's true. It'll be interesting to see how things unfold in the coming weeks and what impact the rise of the AfD will have on Germany's future.

",completed,https://vrsbermuilpkvjdnnhtf.supabase.co/storage/v1/object/public/audio-files/chunks/17abd9a3-a3c7-4a17-9692-171809b4f857/c64ab137-f340-4b1e-9e5e-fc77137aeaf8/chunk_2.mp3,,2025-03-01 07:28:58.516879+00,2025-03-01 07:30:49.10406+00
7539276c-e0ef-46fe-9007-387fe1d63159,c64ab137-f340-4b1e-9e5e-fc77137aeaf8,0,"Alice: Hey there, fellow podcast enthusiasts! Welcome back to another exciting episode of ""Current Affairs Uncovered."" I'm your host, Alice, and I'm thrilled to have my co-host, Bob, by my side.

Bob: Thanks, Alice! It's always a pleasure to dive into the world of current events with you. And folks, today we have quite the lineup for you. We'll be exploring a wide range of topics that are making waves around the globe.

Alice: That's right, Bob. We've got an episode packed with intrigue and insight. We'll be discussing Germany's Election Results and the impact of the AfD (Alternative for Germany) party. It's a fascinating development that's been grabbing headlines lately.

Bob: Absolutely, Alice. And we'll also be delving into The Hague Service Convention, which deals with serving legal summons across borders. Trust me, it's not as dry as it sounds! This convention has huge implications for international legal proceedings.

Alice: And let's not forget about our adorable heroes in the next topic, Bob. We'll be exploring how African giant pouched rats are being used to diagnose tuberculosis. Who would have thought these little critters could play such a vital role in healthcare?

Bob: It's amazing what animals can do, Alice. And shifting gears a bit, we'll be analyzing the impact of the U.S. Ukraine policy shift on the ongoing Russia-Ukraine war. The geopolitical implications are significant, and we'll be breaking it all down for you.

Alice: And we'll also be discussing ""Trump 2.0"" and the challenges ahead for U.S.-India defense ties. It's certainly an area that's been undergoing some fascinating shifts in recent times.

",completed,https://vrsbermuilpkvjdnnhtf.supabase.co/storage/v1/object/public/audio-files/chunks/17abd9a3-a3c7-4a17-9692-171809b4f857/c64ab137-f340-4b1e-9e5e-fc77137aeaf8/chunk_0.mp3,,2025-03-01 07:28:57.728561+00,2025-03-01 07:29:37.590389+00
7c699183-f411-468d-8d2d-d715dffa4442,c64ab137-f340-4b1e-9e5e-fc77137aeaf8,16,"Alice: Absolutely, Bob. The selection process for such high constitutional authorities should inspire confidence in the citizens of India. Any flaws or biases in the process could undermine the credibility and integrity of the electoral system.

Bob: It will be interesting to see how the Supreme Court addresses these concerns and whether any changes or amendments will be made to ensure a more fair and objective selection process in the future.

Alice: Indeed, Bob. The Supreme Court's decision on this matter will have significant implications for the future of free and fair elections in India.

Bob: That's all for this article. It's important to highlight these issues and engage in discussions about the integrity of our electoral processes. Don't forget to stay tuned for more thought-provoking topics on our podcast.

Alice: That's right, Bob. We'll be back with another fascinating article in our next episode. Until then, keep questioning, keep seeking answers, and keep striving for a better world.

Alice: And that brings us to the end of today's episode! We covered quite a range of topics, didn't we, Bob?

Bob: We sure did, Alice! From Germany's election results and the rise of AfD to the Hague Service Convention and serving summons across borders, it's been a fascinating discussion.

Alice: Absolutely, and let's not forget the innovative TB diagnosis using African giant pouched rats. Who would have thought?

Bob: Those rats are truly incredible, Alice. And we also delved into the impact of the U.S. Ukraine policy shift on the Russia-Ukraine war, as well as the evolving U.S.-India defense ties under Trump 2.0.

",pending,,,2025-03-01 07:29:01.910655+00,2025-03-01 07:29:01.910655+00
830929a2-e438-4ac9-8393-337d0c37d92d,c64ab137-f340-4b1e-9e5e-fc77137aeaf8,11,"Bob: Absolutely, Alice. Now, let's discuss the challenges and controversies surrounding the war and the peace talks. It's disheartening to see that despite the compelling humanitarian argument, with millions of lives lost and massive displacement in Ukraine, finding a solution to this war remains elusive.

Alice: Yes, Bob. One of the challenges mentioned in the article is the influence of ultra-nationalist and neo-Nazi groups in Ukraine. These groups have caused tension since the Soviet era, and as long as they hold power, they are likely to resist any peaceful settlement with Russia. This, coupled with the complex geopolitical dynamics at play, makes the search for a solution even more difficult.

Bob: It's also worth noting that this war is not just a conflict between Russia and Ukraine. It's a proxy war of NATO versus Russia, with Ukraine playing a significant role. Major countries like India and China have expressed their desire for the war to end, but ultimately, the decision lies with the primary actors involved.

Alice: That's a great point, Bob. Now, let's talk about the location of the peace talks. It's interesting that they are happening in Riyadh, Saudi Arabia, instead of traditional locations like Helsinki or Brussels. The article suggests that India may have missed an opportunity to mediate, but they have played a crucial role by being neutral and critiquing sanctions, which has benefited their relationship with Russia.

Bob: That's right, Alice. It seems that India is positioning itself as a close ally of Russia, and this shift in Russia-U.S. ties could be advantageous for India. On the other hand, Europe may be the clear loser in this situation.

",processing,,,2025-03-01 07:29:00.656576+00,2025-03-01 07:29:00.656576+00
a5eaddbb-ba90-4269-a8d8-637b0f00e5a0,c64ab137-f340-4b1e-9e5e-fc77137aeaf8,4,"Alice: Yes, that's correct. India opposes all alternative service methods under Article 10 of the Convention. This means that the service of judicial documents through diplomatic or consular channels is prohibited, except when the recipient is a national of the requesting country.

Bob: That's an important distinction to keep in mind. So, how long does the service process typically take under the Hague Service Convention?

Alice: Well, the article mentions that the entire process usually takes about six to eight months. It involves the designated central authority of the receiving country, in this case, India's Ministry of Law and Justice, reviewing the service request and serving the defendant.

Bob: That's quite a lengthy process. I can imagine it can be quite challenging for parties involved in cross-border litigation.

Alice: Absolutely, Bob. Cross-border litigation can be complex, and that's why the Hague Service Convention plays a crucial role in ensuring that defendants receive proper notice of legal proceedings. It provides a framework for service that is recognized by multiple countries.

Bob: It's interesting to see how international agreements like the Hague Service Convention are essential in today's globalized world, where legal disputes can span across borders.

Alice: Definitely, Bob. The Convention helps streamline the process and provides certainty and reliability when serving summons in foreign jurisdictions. It's a vital tool for promoting access to justice and maintaining the rule of law.

Bob: Absolutely, Alice. And it's important to note that the Convention is not without its challenges and controversies. Different countries may have their own reservations or interpretations of the rules, which can create complexities in the service process.

",completed,https://vrsbermuilpkvjdnnhtf.supabase.co/storage/v1/object/public/audio-files/chunks/17abd9a3-a3c7-4a17-9692-171809b4f857/c64ab137-f340-4b1e-9e5e-fc77137aeaf8/chunk_4.mp3,,2025-03-01 07:28:58.827234+00,2025-03-01 07:32:02.398968+00
a64c4b08-94f0-4641-a1f3-065373bba511,c64ab137-f340-4b1e-9e5e-fc77137aeaf8,12,"Alice: That's all for this article. The U.S.'s changed Ukraine policy has certainly sparked debates and uncertainties about the future of the Russia-Ukraine war. We'll have to keep a close eye on the developments and see how this new approach unfolds.

Bob: Absolutely, Alice. It's a complex situation with no easy solutions, but we can hope that the pursuit of peace and stability remains at the forefront. Stay tuned for more updates on this issue and other important topics. Thank you for listening, and we'll catch you in the next segment.

Alice: Let's discuss the article ""Trump 2.0: U.S.-India Defence Ties and Challenges Ahead."" In this piece, the author highlights the recent visit of Indian Prime Minister Narendra Modi to the United States, which has given a boost to the U.S.-India bilateral defence engagement.

Bob: Absolutely, Alice. This visit has certainly caught a lot of attention, and it's interesting to see how defence acquisitions will expand interoperability between the two countries. One of the agreements mentioned in the article is India's likely purchase and co-production of the 'Javelin' Anti-Tank Guided Missile and 'Stryker' Infantry Combat Vehicles. This move will not only boost domestic manufacturing in India but also integrate the country more into the supply chain for these systems.

Alice: That's right, Bob. The article also mentions the purchase of six more P-8I maritime patrol aircraft by India to augment their Navy's Maritime Domain Awareness. And it's not just about acquisitions, but also about collaboration in unmanned aerial systems and autonomous systems. This includes contracts already underway between Anduril Industries and the Mahindra Group, as well as the co-development by L3Harris and Bharat Electronics Limited of Active Towed Array Systems. It's interesting to see the emphasis on these emerging technologies.

",pending,,,2025-03-01 07:29:00.806825+00,2025-03-01 07:29:00.806825+00
b80bdfbd-af7c-49bd-91ea-e21dffc61881,c64ab137-f340-4b1e-9e5e-fc77137aeaf8,15,"Bob: It's interesting to note that the new law also establishes a search committee to prepare a list of potential candidates. However, the names of these candidates have not been made public. This lack of transparency adds to the concerns surrounding the selection process.

Alice: Yes, and one of the major flaws highlighted in the article is the composition of the select committee itself. The law creates a majority in favor of the government-supported candidate, as the Prime Minister and the cabinet Minister will always constitute the majority. This raises questions about the objective assessment of all the candidates and the potential for bias in the selection process.

Bob: Absolutely, Alice. The provision of this law seems to favor the government-supported candidate, which may undermine the principles of free and fair elections. The selection of the Chief Election Commissioner and Election Commissioners is crucial for maintaining the integrity of the electoral process.

Alice: That's right, Bob. The article argues that this provision may violate Article 14 of the Constitution, which guarantees equality before the law. The Supreme Court will have to carefully examine this law and its potential impact on the fairness of elections.

Bob: It's interesting to see how this issue relates to the broader context of ensuring free and fair elections. With India having a massive voting population of around 960 million voters, conducting elections in a fair manner becomes a monumental task. It's crucial to have individuals with unimpeachable integrity and impartiality leading the Election Commission.

",pending,,,2025-03-01 07:29:01.511881+00,2025-03-01 07:29:01.511881+00
ba4e8979-4503-49f0-8b3b-5403c37d67b0,c64ab137-f340-4b1e-9e5e-fc77137aeaf8,7,"Bob: It's incredible how these rats can be trained to detect TB with such accuracy, Alice. They undergo a rigorous training process starting at just two to three months old, lasting up to nine months. They are exposed to sputum samples, and when they successfully identify TB-positive samples, researchers signal their success with a clicking sound, followed by a reward of a smoothie. This positive reinforcement helps hone their skills.

Alice: And the efficiency of these rats is impressive, Bob. They can test 100 samples in just 20 minutes, a process that would typically take a technician three to four days using conventional methods. In fact, a study published in BMC Infectious Diseases found that these rats were able to detect increased tuberculosis cases in both children and adults in Tanzania. They identified TB at twice the rate compared to conventional testing.

Bob: That's a significant improvement, Alice. Especially considering that TB is generally difficult to detect in children. The rats' ability to identify TB quickly and accurately helps improve early diagnosis and curtails transmission, particularly in areas with limited resources. And the best part is that these rats have successfully transformed TB diagnosis in three countries: Tanzania, Mozambique, and Ethiopia.

Alice: It's fascinating to see how animals like these rats can play a crucial role in disease detection, Bob. But they're not the only ones. Dogs, for example, with their exceptional sense of smell, have been used to identify diseases like Parkinson's. And even ants have shown promise in detecting cancer cells using chemical cues and a sugar reward.

",completed,https://vrsbermuilpkvjdnnhtf.supabase.co/storage/v1/object/public/audio-files/chunks/17abd9a3-a3c7-4a17-9692-171809b4f857/c64ab137-f340-4b1e-9e5e-fc77137aeaf8/chunk_7.mp3,,2025-03-01 07:29:00.042504+00,2025-03-01 07:33:31.723401+00
d8bcfc2c-cca7-4bd1-b7f8-f83415ccc05f,c64ab137-f340-4b1e-9e5e-fc77137aeaf8,17,"Alice: It's been quite the whirlwind, Bob. But if there's one key takeaway from all these articles, it's the interconnectedness of our world. Whether it's political shifts, legal conventions, or scientific breakthroughs, everything is intertwined.

Bob: That's right, Alice. And it's important for us as global citizens to stay informed and engaged. These topics might seem distant, but they have real implications on our lives and the world we live in.

Alice: So, listeners, we encourage you to reflect on what we've discussed today. How do these articles impact your understanding of the world? And what actions can you take to make a difference?

Bob: And as always, thank you for joining us on this journey. We appreciate each and every one of you for listening, and we hope you found today's episode informative and thought-provoking.

Alice: Stay tuned for future episodes where we'll continue to explore the issues shaping our world. Who knows what fascinating topics we'll uncover next?

Bob: That's right, Alice. Until then, keep questioning, keep learning, and keep making a difference. Together, we can navigate this complex world and create a brighter future.

Alice: Take care, everyone, and see you next time!

[Outro music fades in]",pending,,,2025-03-01 07:29:02.315775+00,2025-03-01 07:29:02.315775+00
